title,description,data_needs,idea_id,feasibility_score,feasibility_notes,co2_kg_per_year,impact_score,summary,risk_level,mitigation_suggestions,utility_score
Climate Change Impact Prediction System,"A deep learning system that predicts climate change impacts (e.g., sea-level rise, droughts) based on historical trends, atmospheric conditions, and geographical information. Uses convolutional neural networks to analyze spatial patterns.","['Historical climate data', 'atmospheric records', 'geographical maps']",14_climate_change_impact_prediction_system,0.45,"Data availability poses a moderate challenge due to specificity; however, established models are applicable. Compute requirements are manageable with standard GPUs. Deployment path necessitates integration with existing sensor networks which could be complex.",70000,0.683333333333333,"should explain that the system's main impact is through enabling proactive measures and informing policy, leading to high policy applicability and social benefits but limited direct emissions reduction.
</think>",medium,"['Incorporate a bias detection module during training that quantifies regional prediction disparities using metrics like the Gini coefficient for model error distribution across geographical regions, ensuring underrepresented areas are prioritized for data augmentation.', ""Implement a model-agnostic explanation framework (e.g., SHAP) with spatial attribution maps to visualize which geographical features most influence the CNN's impact predictions, providing stakeholders with interactive visualizations of model reasoning."", ""Deploy a carbon-aware training pipeline that uses energy-efficient neural network pruning techniques and schedules model training during periods of high renewable energy availability in the data center's grid.""]",3.8833333333333324
Sustainable Transportation Optimization Network,"An ML algorithm that optimizes sustainable transportation by analyzing traffic patterns, energy consumption, and climate conditions. Combines reinforcement learning with machine learning algorithms to predict optimal routes and modes of transport.","['Traffic data', 'energy consumption data', 'climate models']",15_sustainable_transportation_optimization_network,0.85,"Standard ML architectures are well-suited for this task, leveraging recent advancements in traffic pattern recognition and energy consumption modeling. Data acquisition could be challenging due to specificity, but existing datasets provide a solid foundation. Compute needs are manageable with standard GPUs, and deployment path is relatively straightforward, relying on integration with existing sensor networks that have become commonplace.",10000,0.799999999999999,"The project's integration of reinforcement learning and ML offers strong potential for reducing emissions through optimized routing and sustainable transport suggestions. It can inform policy by highlighting key areas for intervention, though broader policy needs might require additional data. Social benefits arise from reduced emissions and improved traffic efficiency, though implementation challenges could affect the maximum impact.
</think>",medium,"['**Implement fairness-aware reinforcement learning constraints** to ensure the algorithm prioritizes underserved communities by explicitly weighting route optimization outcomes against demographic equity metrics (e.g., ensuring 30% of optimized routes improve access for low-income neighborhoods).', '**Integrate real-time explainability dashboards** using SHAP (SHapley Additive exPlanations) values to break down how traffic, energy, and climate variables influence route decisions, with visual heatmaps showing the algorithm’s prioritization logic for each proposed route.', '**Conduct biannual community impact audits** with participatory workshops in diverse regions to validate that the system’s recommendations reduce transportation inequities (e.g., measuring a 20% reduction in average commute time disparities between high- and low-income areas over two years).']",8.6
Climate-Resilient Agriculture Supply Chain Optimization System,"A deep learning model that optimizes climate-resilient agriculture supply chains by analyzing crop yields, weather patterns, and transportation logistics. Uses graph theory to predict demand and supply fluctuations.","['Crop yield records', 'weather data', 'transportation logistics']",16_climate-resilient_agriculture_supply_chain_optimiz,0.7000000000000001,"Large data requirements pose a challenge due to specificity, but leveraging public datasets and established model architectures can mitigate this. The proposed graph theory-based model is novel yet manageable with current standard GPU capabilities. Deployment would require integrating with existing sensor networks, introducing complexity but also potential for efficient real-time optimization.",50000,0.7833333333333331,.,medium,"['**Integrate fairness-aware algorithms during training** to adjust for historical biases in resource allocation (e.g., favoring large agribusinesses over small-scale farmers) by weighting the model’s optimization function to prioritize equitable distribution of climate-resilient resources.', '**Develop a model-agnostic explainability framework** using SHAP (SHapley Additive exPlanations) values specifically tailored to the graph-based predictions, providing stakeholders with visual explanations of how supply chain nodes (e.g., farms, warehouses) and edges (e.g., transportation routes) influence demand/supply forecasts.', '**Establish a stakeholder feedback loop** where farmers and local cooperatives can report discrepancies in the model’s recommendations, which are then used to retrain the model with bias-corrected data every six months, ensuring continuous improvement in equity and accuracy.']",6.683333333333334
Ocean Thermal Energy Conversion Monitoring System,"An ML algorithm that monitors ocean thermal energy conversion (OTEC) systems using sensor data, machine learning algorithms, and predictive models. Combines decision trees with neural networks to predict efficiency and output.","['Sensor data', 'OTEC records', 'climate models']",17_ocean_thermal_energy_conversion_monitoring_system,0.8,"Availability of relevant climate models and OTEC records are moderate facilitators. Data volume is manageable with existing public datasets; however, specific sensor data might pose challenges. Proposed model utilizes established decision tree and neural network architectures that fit within standard GPU capabilities. Deployment path requires integration with existing sensor networks which could be complex, but such an integration has been done successfully in similar applications.",60000,0.6333333333333331,"would tie these together.
</think>",medium,"['Integrate ecological impact thresholds into the neural network training process by weighting predictions with real-time marine biodiversity data, ensuring the model avoids optimizing efficiency at the expense of thermal discharge levels harmful to local ecosystems.', 'Implement a hybrid explainability framework that uses SHAP (SHapley Additive exPlanations) for neural network outputs and visualizes decision tree splits in the monitoring interface, enabling operators to trace efficiency predictions to sensor-specific inputs like temperature gradients or flow rates.', 'Establish a feedback loop with marine biologists to validate model outputs against ecological benchmarks, requiring the system to flag any predicted operational adjustments that exceed pre-defined thresholds for water temperature changes or marine species exposure risk.']",7.433333333333334
Climate-Driven Biodiversity Loss Prediction System,"A deep learning system that predicts climate-driven biodiversity loss by analyzing species distributions, weather patterns, and habitat conditions. Uses convolutional neural networks to analyze spatial patterns.","['Species distribution records', 'weather data', 'habitat maps']",18_climate-driven_biodiversity_loss_prediction_system,0.8,"Relies on readily available public datasets for species distribution records and weather data. Convolutional neural networks are suitable for analyzing spatial patterns in habitat conditions. Compute needs are manageable with standard GPUs, but may require specialized hardware for large-scale training of novel models if needed. Deployment path is relatively straightforward, as it primarily involves integrating with existing systems and infrastructure.",600000,0.6333333333333331,"is concise.
</think>",high,"['Implement a **geographically and taxonomically stratified data audit** to ensure training datasets include underrepresented species and regions, reducing bias in predictions for ecologically critical but data-scarce areas.', 'Integrate **model-agnostic explainability tools** (e.g., SHAP values or attention heatmaps) to visualize how habitat conditions and weather patterns influence species risk scores, enabling stakeholders to validate assumptions.', 'Establish a **collaborative feedback loop** with regional conservation experts to validate model outputs against ground-truth ecological surveys, ensuring predictions align with local biodiversity dynamics and reducing ecological harm from misinformed decisions.']",1.633333333333332
