title,description,data_needs,idea_id,feasibility_score,feasibility_notes,co2_kg_per_year,impact_score,summary,risk_level,mitigation_suggestions,utility_score
Climate Tipping Point Prediction System,A deep learning system that identifies potential climate tipping points by analyzing historical climate data and current trends. Uses recurrent neural networks to process time series data from multiple sources to predict non-linear climate transitions.,"['Historical climate records', 'current sensor data', 'satellite imagery']",1_climate_tipping_point_prediction_system,0.65,"Moderate data acquisition challenges due to specificity, but utilizes established model architectures. Compute needs are manageable with standard GPUs. Deployment path requires integration with existing sensor networks which could be complex.",500000,0.6333333333333331,"should explain that while it doesn't directly cut emissions, it's valuable for policy and societal preparedness.
</think>",high,"['**Implement geospatial data equity audits** to identify and correct underrepresentation of climate data from low-income regions. Partner with international climate agencies to integrate localized datasets and apply bias correction algorithms (e.g., adversarial debiasing) during model training.', '**Develop RNN-specific explainability tools** using attention heatmaps to visualize which historical climate variables (e.g., Arctic ice melt, deforestation rates) most influence tipping point predictions. Validate these explanations with climate scientists to ensure alignment with physical climate mechanisms.', '**Establish a dynamic uncertainty quantification module** that outputs probabilistic confidence intervals for tipping point predictions. This would prevent overreliance on deterministic forecasts and require users to acknowledge uncertainty thresholds before acting on high-stakes decisions.']",1.1333333333333329
Carbon Sequestration Optimization Network,An ML algorithm that determines optimal locations and methods for carbon sequestration based on geographical and atmospheric conditions. Combines computer vision analysis of terrain with climate models to maximize carbon capture efficiency.,"['Historical climate records', 'current sensor data', 'satellite imagery']",2_carbon_sequestration_optimization_network,0.8,"Utilizes readily available public climate datasets. Computer vision analysis can be done with established model architectures. High-performance computing is not required, but might need specialized satellite image processing hardware for optimal results. Deployment path does not pose significant integration challenges with existing sensor networks and infrastructure.",400000,0.866666666666666,"should explain that the project enhances efficiency in carbon capture, aiding policy decisions with data-driven insights, and offers broad societal benefits through climate mitigation, though implementation details could affect the social impact.
</think>",high,"['**Integrate fairness-aware geospatial bias audits**: Systematically evaluate training data for geographic and socio-economic representation to prevent algorithmic prioritization of regions with higher data quality or political influence. Use fairness metrics (e.g., demographic parity in carbon capture site allocation) to ensure marginalized communities are not systematically excluded.', '**Embed ecological impact constraints in optimization models**: Incorporate real-time biodiversity and ecosystem health datasets (e.g., IUCN Red List metrics, soil health indices) as hard constraints in the ML algorithm. This ensures recommendations avoid ecologically sensitive zones, reducing the risk of unintended habitat destruction.', '**Develop a dynamic explainability dashboard**: Create a stakeholder-facing interface that visualizes decision logic using SHAP values or LIME explanations, highlighting how terrain, climate, and ecological factors weight into site recommendations. Require third-party validation by independent environmental scientists to ensure transparency.']",3.8666666666666654
Weather Pattern Classification using Deep Learning,"A deep learning model that classifies weather patterns into different categories (e.g., sunny, rainy, cloudy) based on satellite and radar data. Uses convolutional neural networks to analyze spatial and temporal patterns.","['Satellite images', 'radar data', 'weather station records']",3_weather_pattern_classification_using_deep_learning,0.7000000000000001,"Relies on publicly available satellite images and radar data, which are readily accessible. However, high-quality weather station records are difficult to obtain due to their specificity and proprietary nature, posing a moderate acquisition challenge. The use of established convolutional neural networks mitigates the technical risk associated with model complexity. Compute needs are manageable with standard GPUs, but integration with existing sensor networks could introduce complexity in deployment.",1000,0.766666666666666,"This project indirectly reduces emissions by improving weather forecasting accuracy, enabling better energy grid management and disaster preparedness. It is highly applicable to climate policy, as precise weather classification aids in planning for climate resilience and resource allocation. The social benefit is significant due to enhanced early warning systems for extreme weather, supporting agriculture, and improving public safety.",medium,"['**Implement geographically stratified data collection and augmentation**: Ensure training datasets include satellite/radar data from diverse regions (e.g., rural, coastal, arid zones) with historically underrepresented weather patterns. Use synthetic data generation (e.g., GANs) to balance regional biases in temporal-spatial data.', '**Integrate model-agnostic explainability tools**: Deploy post-hoc interpretability methods like SHAP (SHapley Additive exPlanations) or Grad-CAM to visualize CNN decision boundaries in satellite imagery, enabling meteorologists to validate classifications for critical weather events (e.g., storms).', '**Establish regional performance metrics dashboard**: Create a public-facing dashboard tracking model accuracy, false positive/negative rates, and uncertainty scores across geographic zones. Set thresholds for retraining if disparities exceed 10% between regions, ensuring equitable prediction reliability.']",7.156666666666666
Forest Fire Detection using Satellite Imagery,A deep learning model that detects forest fires from satellite images by analyzing optical and infrared signatures. Uses transfer learning and attention mechanisms to focus on key features.,"['Satellite images', 'forest fire records']",4_forest_fire_detection_using_satellite_imagery,0.8,"Relies on large satellite image datasets, some of which might be proprietary or hard to obtain. The proposed model's use of transfer learning and attention mechanisms is beneficial for reducing data requirements. However, the specific nature of forest fire detection may necessitate highly customized model training, adding complexity. Compute needs are manageable with standard GPUs.",600000,0.799999999999999,"Early detection of forest fires can significantly reduce emissions by enabling rapid response, minimizing burned area, and curbing CO2 and particulate matter release. The project’s data-driven insights would enhance policy effectiveness for fire prevention and resource allocation. Social benefits are high due to reduced health risks, property loss, and ecosystem preservation, though impact depends on integration with emergency response systems.",medium,"['**Train the model on geographically and climatically diverse satellite datasets** to reduce bias in fire detection across different ecosystems (e.g., include data from boreal forests, tropical rainforests, and arid regions). Prioritize underrepresented regions in the training pipeline.', '**Implement attention-visualization tools** that highlight specific infrared/optical signatures the model uses to flag fires, enabling human reviewers to validate decisions and identify potential errors in real-time.', '**Partner with local fire management agencies** to test the system in varied environments and collect feedback on false positives/negatives, ensuring the model adapts to regional fire patterns and reduces ecological harm from delayed responses.']",2.199999999999998
Climate-Resilient Agriculture Network,"An ML algorithm that predicts optimal crop yields and disease resistance based on climate models, soil conditions, and agricultural practices. Combines decision trees with neural networks to analyze complex data.","['Agricultural data', 'climate models', 'satellite imagery']",5_climate-resilient_agriculture_network,0.7000000000000001,"Moderate data acquisition challenges due to specificity, but utilizes established model architectures. Compute needs are manageable with standard GPUs. Deployment path requires integration with existing sensor networks which could be complex.",1000,0.65,"should explain that while direct emissions reduction is limited, the project supports sustainable practices, informs policies, and enhances food security and economic stability.
</think>",medium,"['**Ensure diverse training data curation** by explicitly including soil and climate data from smallholder farms in low-income regions, alongside large-scale agricultural operations, to prevent regional and socioeconomic bias in yield predictions. Partner with local cooperatives to validate data representativeness.', '**Implement hybrid model explainability** by using decision trees as the primary interpretable layer for crop recommendation logic while applying SHAP (SHapley Additive exPlanations) to decompose neural network outputs into human-readable feature contributions for disease resistance predictions.', '**Establish ecological feedback loops** by integrating real-time satellite and soil moisture data into the model to dynamically adjust irrigation and crop rotation recommendations, reducing the risk of resource overuse. Monitor water usage metrics in pilot regions to quantify ecological impact reductions.']",7.040000000000001
Ocean Acidification Monitoring System,"A deep learning system that monitors ocean acidification by analyzing pH levels, temperature, and nutrient concentrations. Uses recurrent neural networks to process time series data from multiple sources.","['Oceanographic data', 'laboratory records']",6_ocean_acidification_monitoring_system,0.62,"Relies on proprietary oceanographic data, which may be difficult to obtain or replicate. Utilizes established deep learning architectures but requires significant computational resources due to processing large time series datasets. Deployment path poses challenges in integrating with existing sensor networks and maintaining the system's accuracy over time.",300000,0.6333333333333331,"The project directly monitors ocean acidification but does not reduce emissions itself, explaining the low EMISSIONS_REDUCTION score. Its high POLICY_APPLICABILITY stems from providing critical data for informed climate and environmental policies. SOCIAL_BENEFIT is high because the system safeguards marine ecosystems, which are vital for food security, biodiversity, and coastal communities' livelihoods.",medium,"['**Collaborate with international marine research institutions** to collect and integrate data from underrepresented oceanic regions (e.g., Southern Ocean, equatorial zones), ensuring the training dataset covers diverse ecosystems. Use stratified sampling to balance regional representation in the dataset.', ""**Implement attention mechanisms within the RNN architecture** to highlight temporal patterns in the data that most influence predictions. Generate dynamic visual dashboards that display these attention weights alongside real-time data, making the model's reasoning accessible to stakeholders."", ""**Establish an external review panel comprising climate scientists and AI ethicists** to audit the model's performance and bias across different regions. Set measurable targets, such as reducing regional prediction error variance by 20% in underrepresented areas within the first year of deployment.""]",3.2333333333333325
Smart Grid for Renewable Energy Integration,An ML algorithm that optimizes renewable energy integration into the grid using predictive models and real-time data analysis. Combines reinforcement learning with graph theory to predict energy demand and supply.,"['Renewable energy data', 'grid management data']",7_smart_grid_for_renewable_energy_integration,0.8,"Moderate data acquisition challenges due to specificity, but utilizes established model architectures. Compute needs are manageable with standard GPUs. Deployment path requires integration with existing sensor networks which could be complex.",12000,0.799999999999999,"The project leverages advanced ML to optimize renewable energy integration, reducing reliance on fossil fuels during peak demand, hence achieving strong emissions reduction. Its data-driven insights can inform energy policies, though broader applicability depends on regional grid infrastructure. Social benefits include improved energy reliability, lower costs, and enhanced adoption of renewables, directly benefiting communities through cleaner and more affordable power.",medium,"['Incorporate fairness constraints into the reinforcement learning framework to ensure equitable energy distribution across socioeconomically diverse regions by optimizing for both efficiency and demographic coverage in grid planning.', 'Implement differential privacy techniques during data preprocessing to anonymize individual energy consumption patterns while preserving statistical utility for demand forecasting models.', 'Develop a model-agnostic explainability dashboard using SHAP values to audit real-time energy allocation decisions, ensuring transparency in how the algorithm prioritizes grid stability versus equity in underserved communities.']",8.08
Wildlife Migration Pattern Analysis,"A deep learning model that analyzes wildlife migration patterns based on sensor data, GPS tracking, and machine learning algorithms. Uses clustering techniques to identify key species and habitats.","['Sensor data', 'GPS tracking records', 'wildlife records']",8_wildlife_migration_pattern_analysis,0.55,"Moderate data acquisition challenges due to specificity, but utilizes established model architectures. Compute needs are manageable with standard GPUs. Deployment path requires integration with existing sensor networks which could be complex.",1000,0.533333333333333,"would explain that while it doesn't cut emissions directly, it supports policies and ecosystem services, which have social benefits.
</think>",medium,"['**Implement spatial and species-specific data stratification during training** to ensure the model accounts for underrepresented regions and species. For example, apply weighted sampling to balance data from fragmented habitats or endangered species, reducing the risk of biased clustering outcomes.', '**Integrate model-agnostic explainability tools (e.g., SHAP or LIME)** directly into the clustering pipeline to generate human-readable visualizations of how sensor/GPS data features influence habitat/species groupings, enabling ecologists to validate or challenge results.', ""**Establish a cross-ecologist-AI validation protocol** where domain experts annotate 10% of the model's top clusters with field-verified ecological relevance, ensuring at least 80% alignment between AI-generated patterns and empirically observed migration behaviors.""]",5.423333333333334
Climate-Driven Disaster Risk Assessment System,"An ML algorithm that assesses climate-driven disaster risk by analyzing historical events, weather patterns, and geographical conditions. Combines decision trees with neural networks to predict vulnerability zones.","['Historical disaster records', 'weather data', 'geographical maps']",9_climate-driven_disaster_risk_assessment_system,0.65,"Moderate data acquisition challenges due to specificity, but utilizes established model architectures. Compute needs are manageable with standard GPUs. Deployment path requires integration with existing sensor networks which could be complex.",1000,0.6666666666666661,"should explain that while it doesn't reduce emissions directly, it helps in policy and community resilience.
</think>",high,"['Implement **bias audits for historical event datasets** by cross-referencing with localized disaster records from underrepresented regions (e.g., small island nations, rural communities) to ensure equitable risk modeling. Use fairness-aware metrics like **demographic parity in vulnerability zone classifications** to quantify bias reduction.', 'Apply **SHAP (SHapley Additive exPlanations) values** to the neural network component to generate feature importance maps for each prediction, and **visualize decision tree splits** in a geospatial dashboard to clarify how geographic and climatic variables interact in risk assessments.', 'Partner with **climate justice organizations** to validate model outputs against real-world equity impacts, setting a target to reduce **disparity in risk scores between high-income and low-income regions by 20%** through iterative feedback loops.']",6.156666666666666
Water Quality Monitoring Network,"A deep learning system that monitors water quality in real-time using sensor data, machine learning algorithms, and predictive models. Uses convolutional neural networks to analyze spatial patterns.","['Sensor data', 'laboratory records', 'geographical maps']",10_water_quality_monitoring_network,0.72,"Data availability challenges due to specificity of sensor data. However, convolutional neural networks can handle spatial patterns effectively. Compute needs are manageable with standard GPUs, but deployment path requires integration with existing sensor networks which could be complex.",5000,0.6333333333333331,"The project indirectly reduces emissions by preventing water pollution, which can lower methane from algal blooms. The real-time data supports policy decisions and has high social value by improving water safety and public health.
</think>",medium,"['Conduct a geographic equity audit of sensor deployment to identify and correct coverage gaps in underserved or marginalized communities, ensuring spatial data representativeness.', 'Implement Grad-CAM (Gradient-weighted Class Activation Mapping) to visualize the spatial patterns the CNN uses for predictions, enabling stakeholders to verify whether the model’s focus aligns with physically meaningful water quality indicators.', 'Establish a community feedback portal where residents can report water quality anomalies not captured by sensors, using these reports to recalibrate sensor placement and model training data annually.']",7.183333333333332
Urban Heat Island Mitigation Strategies,"An ML algorithm that identifies optimal urban heat island mitigation strategies based on building designs, materials, and climate conditions. Combines computer vision analysis with machine learning algorithms to predict heat island effects.","['Building designs', 'climate models', 'sensor data']",11_urban_heat_island_mitigation_strategies,0.8200000000000001,"Moderate data acquisition challenges due to specificity, but utilizes established model architectures. Compute needs are manageable with standard GPUs. Deployment path requires integration with existing sensor networks which could be complex, and while building designs can be crowdsourced, climate models might require significant computational resources, limiting scalability.",30000,0.7000000000000001,"This project has strong potential to reduce urban energy demands for cooling (and associated emissions) by optimizing building designs and materials, but its direct emissions impact depends on adoption rates. It provides actionable, data-driven insights for policymakers to design targeted urban planning strategies, making it highly policy-relevant. The social benefits are significant, as mitigating heat islands improves public health, reduces heat-related mortality, and lowers energy costs for communities, particularly vulnerable populations.",high,"['**Incorporate socio-economic and demographic data into training datasets** to ensure the algorithm accounts for disparities in urban heat vulnerability. For example, prioritize data collection from low-income neighborhoods and historically marginalized communities to prevent biased recommendations that overlook their needs.', '**Implement post-processing explainability tools like SHAP (SHapley Additive exPlanations) or LIME (Local Interpretable Model-agnostic Explanations)** to break down how specific building materials, designs, or climate variables influence heat island predictions, ensuring stakeholders can audit and trust the system’s recommendations.', '**Conduct ecological lifecycle assessments (LCAs) of recommended mitigation strategies** (e.g., green roofs, reflective materials) to quantify their carbon footprint and long-term environmental trade-offs, ensuring the system does not inadvertently promote solutions that harm ecosystems (e.g., water-intensive vegetation in arid regions).']",7.6
Climate-Resilient Infrastructure Optimization System,"A deep learning model that optimizes climate-resilient infrastructure by analyzing weather patterns, geographical conditions, and material properties. Uses reinforcement learning to predict maintenance costs and optimize design.","['Weather data', 'geographical maps', 'material properties']",12_climate-resilient_infrastructure_optimization_syst,0.65,"Moderate data acquisition challenges due to specificity, but utilizes established model architectures. Compute needs are manageable with standard GPUs. Deployment path requires integration with existing sensor networks which could be complex.",1000,0.799999999999999,"The project has strong potential to reduce emissions by optimizing infrastructure design and material use, minimizing waste and energy inefficiency. Its integration of climate data into policy frameworks enhances decision-making for resilient urban planning. The social benefit is high due to reduced climate-related infrastructure failures, safeguarding communities and lowering long-term maintenance costs.",medium,"['**Incorporate geographically diverse and socioeconomically representative datasets** into the model’s training pipeline, including underrepresented regions and low-income communities, to prevent biased infrastructure recommendations. Partner with local governments and NGOs to validate data relevance and equity.', '**Embed lifecycle environmental impact metrics** (e.g., carbon footprint, resource depletion) directly into the reinforcement learning reward function to ensure optimization prioritizes both climate resilience and ecological sustainability. Use tools like the Global Warming Potential (GWP) database for material selection.', '**Implement a cross-disciplinary oversight panel** with urban planners, environmental scientists, and community representatives to review and challenge model outputs, ensuring decisions align with local ecological constraints and social equity goals (e.g., requiring 90% stakeholder approval for high-impact design changes).']",6.6899999999999995
Ecosystem Services Monitoring Network,"An ML algorithm that monitors ecosystem services (e.g., pollination, pest control) based on sensor data, machine learning algorithms, and predictive models. Combines decision trees with neural networks to predict service delivery.","['Sensor data', 'ecosystem records', 'climate models']",13_ecosystem_services_monitoring_network,0.6000000000000001,"Moderate data acquisition challenges due to specificity, but utilizes established model architectures. Compute needs are manageable with standard GPUs. Deployment path requires integration with existing sensor networks which could be complex.",1000,0.6000000000000001,"The project likely has moderate emissions reduction by preserving ecosystem services that reduce the need for synthetic inputs. It's highly applicable to policy by providing actionable data for conservation and sustainable practices. Social benefits are significant but depend on implementation, aiding communities through enhanced agricultural stability and biodiversity.
</think>",medium,"['**Conduct spatial and ecological bias audits** by validating sensor data coverage across diverse biomes (e.g., urban vs. rural, tropical vs. temperate) and integrating ground-truth data from underrepresented regions to ensure equitable model performance.', '**Implement hybrid model interpretability tools** that decompose neural network predictions using SHAP (SHapley Additive exPlanations) values and map them to decision tree rules, enabling stakeholders to trace how sensor inputs (e.g., temperature, biodiversity metrics) influence service predictions.', '**Establish a sensor deployment protocol** requiring ecological impact assessments (e.g., wildlife disruption, energy consumption) and community consultations in data collection sites to minimize environmental harm and ensure marginalized groups are included in monitoring design.']",5.990000000000002
